,number,value,datetime_start,datetime_complete,duration,params_boosting_type,params_learning_rate,params_n_estimators,params_n_voters,state
0,0,0.8853870476741432,2024-06-05 10:55:36.431230,2024-06-05 10:57:27.994247,0 days 00:01:51.563017,gbdt,0.049583999194270194,180,15,COMPLETE
1,1,0.8682722393654574,2024-06-05 10:57:28.036931,2024-06-05 10:58:03.917219,0 days 00:00:35.880288,gbdt,0.028756885542367855,60,10,COMPLETE
2,2,0.8673928962924744,2024-06-05 10:58:03.943144,2024-06-05 10:59:05.800986,0 days 00:01:01.857842,dart,0.09771023001993191,80,20,COMPLETE
3,3,0.8647228449578928,2024-06-05 10:59:05.824959,2024-06-05 11:00:34.964696,0 days 00:01:29.139737,dart,0.02202944949152839,200,8,COMPLETE
4,4,0.8881750128896293,2024-06-05 11:00:34.985200,2024-06-05 11:02:04.447899,0 days 00:01:29.462699,gbdt,0.08889072270341722,140,15,COMPLETE
5,5,0.5,2024-06-05 11:02:04.473791,2024-06-05 11:02:54.579557,0 days 00:00:50.105766,gbdt,0.0011750716783711689,100,7,COMPLETE
6,6,0.8532958419016758,2024-06-05 11:02:54.607868,2024-06-05 11:04:12.878780,0 days 00:01:18.270912,dart,0.007230185333092962,140,14,COMPLETE
7,7,0.8631322876918992,2024-06-05 11:04:12.898727,2024-06-05 11:05:01.378222,0 days 00:00:48.479495,gbdt,0.03719635374615152,60,19,COMPLETE
8,8,0.8378939656270804,2024-06-05 11:05:01.403661,2024-06-05 11:06:23.226002,0 days 00:01:21.822341,dart,0.013704874791346352,120,20,COMPLETE
9,9,0.8655160670690742,2024-06-05 11:06:23.253566,2024-06-05 11:07:21.182252,0 days 00:00:57.928686,gbdt,0.014628097240409726,100,12,COMPLETE
10,10,0.807671220625711,2024-06-05 11:07:21.204818,2024-06-05 11:09:23.377896,0 days 00:02:02.173078,gbdt,0.08912943616101923,160,2,COMPLETE
11,11,0.8867449950587076,2024-06-05 11:09:23.401873,2024-06-05 11:11:12.844978,0 days 00:01:49.443105,gbdt,0.05987131134076475,180,15,COMPLETE
12,12,0.8840454056684909,2024-06-05 11:11:12.878465,2024-06-05 11:12:54.888003,0 days 00:01:42.009538,gbdt,0.0600097952339956,160,16,COMPLETE
13,13,0.8834964289654194,2024-06-05 11:12:54.911635,2024-06-05 11:15:03.241229,0 days 00:02:08.329594,gbdt,0.0827803034611895,200,17,COMPLETE
14,14,0.8830018952670635,2024-06-05 11:15:03.263901,2024-06-05 11:16:36.734840,0 days 00:01:33.470939,gbdt,0.043999411679540905,160,13,COMPLETE
15,15,0.891458890845269,2024-06-05 11:16:36.759285,2024-06-05 11:17:48.725832,0 days 00:01:11.966547,gbdt,0.09830019889092606,140,10,COMPLETE
16,16,0.8416829743097736,2024-06-05 11:17:48.749369,2024-06-05 11:19:09.929881,0 days 00:01:21.180512,gbdt,0.09881879809828929,120,3,COMPLETE
17,17,0.8694155723529973,2024-06-05 11:19:09.954100,2024-06-05 11:20:21.222264,0 days 00:01:11.268164,gbdt,0.027927034950398454,140,6,COMPLETE
18,18,0.8720976032009039,2024-06-05 11:20:21.250389,2024-06-05 11:21:11.849943,0 days 00:00:50.599554,dart,0.05194154998160749,100,10,COMPLETE
19,19,0.8817323391487406,2024-06-05 11:21:11.873049,2024-06-05 11:22:28.227983,0 days 00:01:16.354934,gbdt,0.034590992303799084,140,11,COMPLETE
20,20,0.7800575413982973,2024-06-05 11:22:28.248833,2024-06-05 11:23:30.032032,0 days 00:01:01.783199,gbdt,0.007525854653337034,120,5,COMPLETE
21,21,0.8841088733696782,2024-06-05 11:23:30.056208,2024-06-05 11:25:26.201734,0 days 00:01:56.145526,gbdt,0.07033603645361394,180,17,COMPLETE
22,22,0.889298315046964,2024-06-05 11:25:26.230130,2024-06-05 11:26:54.179467,0 days 00:01:27.949337,gbdt,0.06375873386662577,180,9,COMPLETE
23,23,0.8889936782128007,2024-06-05 11:26:54.212821,2024-06-05 11:28:13.256683,0 days 00:01:19.043862,gbdt,0.06560218142233307,160,9,COMPLETE
24,24,0.8851755453643296,2024-06-05 11:28:13.283267,2024-06-05 11:29:31.878620,0 days 00:01:18.595353,gbdt,0.0488166345401032,160,9,COMPLETE
25,25,0.8584839019681008,2024-06-05 11:29:31.913448,2024-06-05 11:31:14.844163,0 days 00:01:42.930715,gbdt,0.06333996988875262,180,4,COMPLETE
26,26,0.8786341898077717,2024-06-05 11:31:14.870915,2024-06-05 11:32:46.346121,0 days 00:01:31.475206,dart,0.07038687345472115,200,8,COMPLETE
27,27,0.883428828481079,2024-06-05 11:32:46.372520,2024-06-05 11:34:15.827032,0 days 00:01:29.454512,gbdt,0.03625932791454016,160,12,COMPLETE
28,28,0.8754425177622238,2024-06-05 11:34:15.858102,2024-06-05 11:35:41.067117,0 days 00:01:25.209015,gbdt,0.021233790867677745,180,7,COMPLETE
29,29,0.8862585838777985,2024-06-05 11:35:41.090319,2024-06-05 11:37:07.825876,0 days 00:01:26.735557,gbdt,0.042901962397769354,180,9,COMPLETE
30,30,0.889145944114146,2024-06-05 11:37:07.850616,2024-06-05 11:38:39.277972,0 days 00:01:31.427356,gbdt,0.054934181997319156,160,12,COMPLETE
31,31,0.8899361485989152,2024-06-05 11:38:39.300887,2024-06-05 11:40:07.620982,0 days 00:01:28.320095,gbdt,0.05909477632737212,160,11,COMPLETE
32,32,0.885556881494642,2024-06-05 11:40:07.648602,2024-06-05 11:41:24.216740,0 days 00:01:16.568138,gbdt,0.0521584302378047,140,11,COMPLETE
33,33,0.8902411104580411,2024-06-05 11:41:24.249171,2024-06-05 11:43:10.811969,0 days 00:01:46.562798,gbdt,0.09801992281357673,180,13,COMPLETE
34,34,0.8897393543280228,2024-06-05 11:43:10.839798,2024-06-05 11:45:06.900256,0 days 00:01:56.060458,gbdt,0.08575616985771639,200,13,COMPLETE
35,35,0.8805087524554345,2024-06-05 11:45:06.928916,2024-06-05 11:46:56.458933,0 days 00:01:49.530017,dart,0.09916523297283207,200,13,COMPLETE
36,36,0.889027736911754,2024-06-05 11:46:56.479716,2024-06-05 11:48:54.613399,0 days 00:01:58.133683,gbdt,0.07679634898042358,200,14,COMPLETE
37,37,0.8931510124358141,2024-06-05 11:48:54.638670,2024-06-05 11:50:51.129284,0 days 00:01:56.490614,gbdt,0.09450542147452665,200,13,COMPLETE
38,38,0.8769386954978392,2024-06-05 11:50:51.154555,2024-06-05 11:52:23.789150,0 days 00:01:32.634595,dart,0.08133068310629699,180,11,COMPLETE
39,39,0.8879976963509992,2024-06-05 11:52:23.815915,2024-06-05 11:53:50.393635,0 days 00:01:26.577720,gbdt,0.09896015185606775,140,14,COMPLETE
40,40,0.8884191596761035,2024-06-05 11:53:50.416004,2024-06-05 11:55:19.609359,0 days 00:01:29.193355,gbdt,0.04412722937769894,180,10,COMPLETE
41,41,0.8906019062060644,2024-06-05 11:55:19.637376,2024-06-05 11:57:14.427060,0 days 00:01:54.789684,gbdt,0.07859122494541787,200,13,COMPLETE
42,42,0.8887588526449305,2024-06-05 11:57:14.453339,2024-06-05 11:59:18.504381,0 days 00:02:04.051042,gbdt,0.07663405866939553,200,16,COMPLETE
43,43,0.8908261765435632,2024-06-05 11:59:18.529245,2024-06-05 12:01:09.439684,0 days 00:01:50.910439,gbdt,0.07516823140168431,200,12,COMPLETE
44,44,0.8909543863542065,2024-06-05 12:01:09.467990,2024-06-05 12:03:01.279431,0 days 00:01:51.811441,gbdt,0.0764519125034711,200,12,COMPLETE
45,45,0.8829173988763737,2024-06-05 12:03:01.301653,2024-06-05 12:03:57.041232,0 days 00:00:55.739579,gbdt,0.07119598794404117,80,15,COMPLETE
46,46,0.8802592579477906,2024-06-05 12:03:57.072919,2024-06-05 12:05:43.944116,0 days 00:01:46.871197,dart,0.08027521990664563,200,12,COMPLETE
47,47,0.8865660880657458,2024-06-05 12:05:43.967330,2024-06-05 12:07:40.729782,0 days 00:01:56.762452,gbdt,0.049777292500133,200,14,COMPLETE
48,48,0.8691264740262004,2024-06-05 12:07:40.757239,2024-06-05 12:08:21.032810,0 days 00:00:40.275571,gbdt,0.031878592290314034,60,12,COMPLETE
49,49,0.8878257812777717,2024-06-05 12:08:21.056280,2024-06-05 12:10:25.153124,0 days 00:02:04.096844,gbdt,0.05767388269461093,200,16,COMPLETE
